{"schema_version":"v1","id":"runpal","name":"RunPal","summary":"A connected running partner represented in Moments.","website":"https://runpal.fit/","listing_status":"connected","api_availability":"none","capabilities":["moments"],"status_evidence_url":"https://mains.world/space","reviewed_at":"2026-08-29"}
