{"schema_version":"v1","id":"instagram","name":"Instagram","summary":"A future connection for shared photos and posts in Moments and Mains.","website":"https://www.instagram.com/","listing_status":"coming_soon","api_availability":"none","capabilities":["moments","mains"],"reviewed_at":"2026-08-29"}
