{"schema_version":"v1","id":"alerts","name":"Safety Alerts","summary":"A Main's World safety capability represented in Mains.","website":"https://mains.world/how-it-works/safety-alerts","listing_status":"first_party","api_availability":"not_applicable","capabilities":["mains"],"reviewed_at":"2026-08-29"}
